{
  "$schema": "https://json-schema.org/draft/2020-12/schema",
  "$id": "https://infosphere.local/rooms.schema.json",
  "title": "Infosphere map dataset",
  "description": "Floors, rooms and the kiosk location. Coordinates are map units of each floor (origin top-left).",
  "type": "object",
  "required": ["building", "kiosk", "floors", "rooms"],
  "additionalProperties": false,
  "properties": {
    "_comment": { "type": "string" },
    "building": { "type": "string", "minLength": 1 },
    "kiosk": {
      "type": "object",
      "required": ["floor", "room"],
      "additionalProperties": false,
      "properties": {
        "floor": { "type": "integer", "minimum": 1 },
        "room": { "$ref": "#/$defs/id" }
      }
    },
    "floors": {
      "type": "array",
      "minItems": 1,
      "items": {
        "type": "object",
        "required": ["floor", "label", "image", "width", "height", "connector"],
        "additionalProperties": false,
        "properties": {
          "floor": { "type": "integer", "minimum": 1, "maximum": 50 },
          "label": { "type": "string", "pattern": "^Lantai \\d+$" },
          "image": { "type": "string", "pattern": "^lantai-\\d+$" },
          "alt": { "type": "string", "maxLength": 1000 },
          "width": { "type": "integer", "minimum": 100, "maximum": 5000 },
          "height": { "type": "integer", "minimum": 100, "maximum": 5000 },
          "metres_per_unit": { "type": "number", "exclusiveMinimum": 0, "maximum": 1 },
          "walkable": { "$ref": "#/$defs/rect" },
          "inside": { "type": "array", "items": { "$ref": "#/$defs/rect" } },
          "voids": { "type": "array", "items": { "$ref": "#/$defs/rect" } },
          "connector": {
            "type": "object",
            "required": ["name", "xy"],
            "additionalProperties": false,
            "properties": {
              "name": { "type": "string", "minLength": 1 },
              "xy": { "$ref": "#/$defs/point" }
            }
          },
          "access": {
            "description": "A floor (or, with building, one building on that floor) visitors can't reach directly by the connector: they go to one of via_floors, then the stairs. note/_en/_zh is added to every room answer it covers.",
            "type": "object",
            "required": ["via_floors", "note"],
            "additionalProperties": false,
            "properties": {
              "building": { "type": "string", "enum": ["A", "B", "C", "D"] },
              "via_floors": { "type": "array", "items": { "type": "integer", "minimum": 1 }, "minItems": 1 },
              "note": { "type": "string", "minLength": 1, "maxLength": 200 },
              "note_en": { "type": "string", "minLength": 1, "maxLength": 200 },
              "note_zh": { "type": "string", "minLength": 1, "maxLength": 200 }
            }
          }
        }
      }
    },
    "rooms": {
      "type": "array",
      "items": {
        "type": "object",
        "required": ["id", "name", "floor", "type", "aliases"],
        "additionalProperties": false,
        "properties": {
          "id": { "$ref": "#/$defs/id" },
          "name": { "type": "string", "minLength": 1, "maxLength": 80 },
          "name_en": { "type": "string", "minLength": 1, "maxLength": 80 },
          "name_zh": { "type": "string", "minLength": 1, "maxLength": 80 },
          "floor": { "type": "integer", "minimum": 1 },
          "qa_id": {
            "description": "ID of the Dataset Jarvis.xlsx row that answers for this room. Tapping the room on the map then gives that answer — with its human recording (static/audio/Audio<ID>) — exactly like typing the question.",
            "type": "integer",
            "minimum": 1
          },
          "building": { "type": "string", "enum": ["A", "B", "C", "D"] },
          "access": {
            "description": "A room reached only through another room (via_room), e.g. R Baca and the Floor 2 library through the LKC. note/_en/_zh is added to the room's answer; step/_en/_zh is the walking step after reaching via_room.",
            "type": "object",
            "required": ["via_room", "note", "step"],
            "additionalProperties": false,
            "properties": {
              "via_room": { "$ref": "#/$defs/id" },
              "note": { "type": "string", "minLength": 1, "maxLength": 200 },
              "note_en": { "type": "string", "minLength": 1, "maxLength": 200 },
              "note_zh": { "type": "string", "minLength": 1, "maxLength": 200 },
              "step": { "type": "string", "minLength": 1, "maxLength": 120 },
              "step_en": { "type": "string", "minLength": 1, "maxLength": 120 },
              "step_zh": { "type": "string", "minLength": 1, "maxLength": 120 }
            }
          },
          "type": {
            "type": "string",
            "enum": ["classroom", "office", "library", "toilet", "studio", "hall", "lab", "facility"]
          },
          "aliases": {
            "type": "array",
            "items": { "type": "string", "minLength": 1, "maxLength": 60, "pattern": "^[^A-Z]*$" },
            "uniqueItems": true
          },
          "poly": {
            "type": "array",
            "minItems": 3,
            "maxItems": 64,
            "items": { "$ref": "#/$defs/point" }
          },
          "location": { "type": "string", "maxLength": 300 },
          "location_en": { "type": "string", "maxLength": 300 },
          "location_zh": { "type": "string", "maxLength": 300 },
          "near_escalator": { "type": "string" }
        }
      }
    }
  },
  "$defs": {
    "id": { "type": "string", "pattern": "^[a-z0-9][a-z0-9_-]{0,47}$" },
    "point": {
      "type": "array",
      "prefixItems": [{ "type": "number" }, { "type": "number" }],
      "minItems": 2,
      "maxItems": 2
    },
    "rect": {
      "type": "array",
      "items": { "type": "number" },
      "minItems": 4,
      "maxItems": 4
    }
  }
}
