{
  "_comment": "SINGLE SOURCE OF TRUTH for the map. Coordinates are in each floor's map units (floors[].width x height, origin top-left). poly = room outline as [x, y] corners. Check with: python scripts/validate_data.py Optional name_en/name_zh and location_en/location_zh are used for English and Mandarin answers.",
  "building": "Gedung Infosphere",
  "kiosk": {
    "floor": 1,
    "room": "gallery"
  },
  "floors": [
    {
      "floor": 1,
      "label": "Lantai 1",
      "image": "lantai-1",
      "width": 800,
      "height": 530,
      "metres_per_unit": 0.07,
      "alt": "Denah Lantai 1: Gallery Bersama (lokasi kiosk), Library, APPLE, Admisi, Drop Out, SSC, SDC, SADC, UKM dan BCA.",
      "walkable": [ 95, 35, 715, 498 ],
      "connector": {
        "name": "Eskalator",
        "xy": [ 360, 250 ]
      },
      "voids": []
    },
    {
      "floor": 2,
      "label": "Lantai 2",
      "image": "lantai-2",
      "width": 1547,
      "height": 1011,
      "metres_per_unit": 0.05,
      "alt": "Denah Lantai 2: B0201, Library (LKC), Toilet (dekat Library), Studio Fotografi, Greenscreen, Binus TV, Binus Radio, Amphitheatre, C0207, Toilet (dekat C0207), C0201, C0212, C0209, C0206, C0203, C0210, C0205, C0204.",
      "connector": {
        "name": "Eskalator",
        "xy": [ 352, 800 ]
      },
      "voids": [ [657, 439, 837, 594], [250, 717, 455, 882], [645, 697, 830, 760], [625, 842, 830, 882], [312, 587, 395, 662] ]
    },
    {
      "floor": 3,
      "label": "Lantai 3",
      "image": "lantai-3",
      "width": 1454,
      "height": 1025,
      "metres_per_unit": 0.05,
      "alt": "Denah Lantai 3: Kelas Besar B0301, B0302, Toilet (dekat B0302), Library, Finance, Rektorat, SADC, C0301, C0307, Toilet (dekat C0307), C0302, C0312, C0309, C0306, C0303, C0311, C0304, C0305, C0310.",
      "connector": {
        "name": "Eskalator",
        "xy": [ 461, 798 ]
      },
      "voids": [ [323, 715, 600, 882], [403, 580, 520, 677], [523, 567, 695, 677], [860, 709, 1113, 757], [835, 857, 1113, 912] ]
    },
    {
      "floor": 4,
      "label": "Lantai 4",
      "image": "lantai-4",
      "width": 1315,
      "height": 989,
      "metres_per_unit": 0.05,
      "alt": "Denah Lantai 4: Auditorium B0401, B0402, Toilet (dekat B0402), B0403, B0404, B0405, LSC C0407, Toilet (dekat LSC), C0401, LSC C0408-09, IT, C0412, C0411, C0406, C0403, C0410.",
      "connector": {
        "name": "Eskalator",
        "xy": [ 407, 757 ]
      },
      "access": {
        "building": "B",
        "via_floors": [ 3, 5 ],
        "note": "Lantai 4 Gedung B hanya bisa diakses lewat tangga darurat dari Lantai 3 atau Lantai 5, atau naik lift",
        "note_en": "Floor 4 of Building B can only be reached by the emergency stairs from Floor 3 or Floor 5, or by the lift",
        "note_zh": "B栋4楼只能从3楼或5楼走紧急楼梯上去，或乘坐电梯"
      },
      "inside": [ [25, 500, 745, 880], [590, 540, 1205, 970] ],
      "voids": [ [282, 674, 532, 841], [352, 536, 462, 636], [772, 101, 852, 186], [742, 181, 997, 241], [772, 651, 1002, 716], [747, 806, 1002, 848], [202, 281, 347, 371] ]
    }
  ],
  "rooms": [
    {
      "id": "rbaca",
      "name": "R Baca",
      "name_en": "Reading Room (R Baca)",
      "name_zh": "阅览室（R Baca）",
      "floor": 1,
      "type": "facility",
      "aliases": [ "r baca", "ruang baca", "reading", "baca" ],
      "poly": [ [400, 40], [525, 40], [525, 120], [400, 120] ],
      "location": "di dalam LKC, lurus dari pintu masuk LKC, di samping Klinik",
      "location_en": "inside the LKC, straight ahead from the LKC entrance, next to the Clinic",
      "location_zh": "在 LKC 里面，从 LKC 入口直走，诊所旁边",
      "access": {
        "via_room": "library_right",
        "note": "R Baca hanya bisa diakses lewat LKC: masuk LKC lalu jalan lurus",
        "note_en": "The Reading Room can only be reached through the LKC: go in and walk straight ahead",
        "note_zh": "阅览室只能经由 LKC 进入：进入 LKC 后直走",
        "step": "Masuk LKC, lalu jalan lurus ke R Baca",
        "step_en": "Go into the LKC and walk straight ahead to the Reading Room",
        "step_zh": "进入 LKC 后直走到阅览室"
      }
    },
    {
      "id": "library_left",
      "name": "Library (Kiri)",
      "name_en": "Library (Left)",
      "name_zh": "图书馆（左）",
      "floor": 1,
      "type": "library",
      "aliases": [ "library kiri", "library", "perpustakaan kampus", "pustaka" ],
      "poly": [ [175, 55], [320, 55], [320, 165], [175, 165] ],
      "location": "di seberang ruang APPLE, di sebelah kiri Klinik",
      "location_en": "across from the APPLE room, to the left of the Clinic",
      "location_zh": "在 APPLE 教室对面，诊所的左边"
    },
    {
      "id": "klinik",
      "name": "Klinik",
      "name_en": "Clinic (Klinik)",
      "name_zh": "诊所（Klinik）",
      "floor": 1,
      "type": "facility",
      "aliases": [ "klinik", "kesehatan", "dokter", "sakit", "medis" ],
      "poly": [ [330, 95], [398, 95], [398, 165], [330, 165] ],
      "location": "di antara Library (Kiri) dan R Baca",
      "location_en": "between the Library (Left) and the Reading Room",
      "location_zh": "在图书馆（左）和阅览室之间"
    },
    {
      "id": "library_right",
      "name": "Library (LKC)",
      "qa_id": 4,
      "name_en": "Library (LKC)",
      "name_zh": "图书馆（LKC）",
      "floor": 1,
      "type": "library",
      "aliases": [ "lkc", "library kanan", "library and knowledge center", "pintu masuk lkc" ],
      "poly": [ [400, 150], [545, 150], [545, 235], [400, 235] ],
      "location": "di sebelah kanan eskalator, pintu masuk ke R Baca dan ke Library Lantai 2",
      "location_en": "to the right of the escalator; it is the way into the Reading Room and the Floor 2 library",
      "location_zh": "在扶梯右边，是进入阅览室和2楼图书馆的入口"
    },
    {
      "id": "apple",
      "name": "APPLE",
      "floor": 1,
      "type": "lab",
      "aliases": [ "apple", "lab apple", "ruang apple" ],
      "poly": [ [130, 150], [290, 150], [290, 250], [130, 250] ],
      "location": "di seberang Library (Kiri), di sebelah kiri eskalator",
      "location_en": "across from the Library (Left), to the left of the escalator",
      "location_zh": "在图书馆（左）对面，扶梯的左边"
    },
    {
      "id": "gallery",
      "name": "Gallery Bersama",
      "floor": 1,
      "type": "hall",
      "aliases": [ "gallery", "galeri", "lobby", "gallery bersama" ],
      "poly": [ [130, 255], [398, 255], [398, 345], [130, 345] ],
      "location": "di samping eskalator (lokasi kiosk ini)",
      "location_en": "next to the escalator (where this kiosk is)",
      "location_zh": "在扶梯旁边（就是本服务台所在的位置）"
    },
    {
      "id": "admisi",
      "name": "Admisi",
      "name_en": "Admissions (Admisi)",
      "name_zh": "招生处（Admisi）",
      "floor": 1,
      "type": "office",
      "aliases": [ "admisi", "admission", "pendaftaran", "daftar" ],
      "poly": [ [408, 290], [520, 290], [520, 362], [408, 362] ],
      "location": "di sebelah kanan Gallery Bersama, di samping Drop Out",
      "location_en": "to the right of Gallery Bersama, next to Drop Out",
      "location_zh": "在 Gallery Bersama 右边，Drop Out 旁边"
    },
    {
      "id": "dropout",
      "name": "Drop Out",
      "name_en": "Drop Out",
      "name_zh": "Drop Out 区",
      "floor": 1,
      "type": "facility",
      "aliases": [ "drop out", "dropout", "droop out" ],
      "poly": [ [525, 250], [700, 250], [700, 360], [525, 360] ],
      "location": "di ujung kanan gedung, di sebelah kanan Admisi",
      "location_en": "at the far right of the building, to the right of Admissions",
      "location_zh": "在大楼最右侧，招生处的右边"
    },
    {
      "id": "bca",
      "name": "BCA C0111-12",
      "floor": 1,
      "type": "facility",
      "building": "C",
      "aliases": [ "bca", "bank", "atm bca", "c0111", "c0112" ],
      "poly": [ [110, 330], [212, 330], [212, 402], [110, 402] ],
      "location": "di sisi kiri gedung, di ujung kiri Gallery Bersama",
      "location_en": "on the left side of the building, at the left end of Gallery Bersama",
      "location_zh": "在大楼左侧，Gallery Bersama 的左端"
    },
    {
      "id": "ssc",
      "name": "SSC",
      "qa_id": 3,
      "floor": 1,
      "type": "office",
      "aliases": [ "ssc", "student service", "layanan mahasiswa" ],
      "poly": [ [330, 345], [400, 345], [400, 412], [330, 412] ],
      "location": "di seberang Gallery Bersama, di sebelah kiri Marketing",
      "location_en": "across from Gallery Bersama, to the left of Marketing",
      "location_zh": "在 Gallery Bersama 对面，Marketing 的左边"
    },
    {
      "id": "marketing",
      "name": "Marketing",
      "floor": 1,
      "type": "office",
      "aliases": [ "marketing", "pemasaran", "promosi" ],
      "poly": [ [410, 365], [512, 365], [512, 420], [410, 420] ],
      "location": "di samping Admisi, di sebelah kanan SSC",
      "location_en": "next to Admissions, to the right of SSC",
      "location_zh": "在招生处旁边，SSC 的右边"
    },
    {
      "id": "sdc",
      "name": "SDC",
      "floor": 1,
      "type": "office",
      "aliases": [ "sdc", "student development", "pengembangan" ],
      "poly": [ [238, 415], [308, 415], [308, 488], [238, 488] ],
      "location": "di sebelah kiri SADC, dekat SSC",
      "location_en": "to the left of SADC, near SSC",
      "location_zh": "在 SADC 的左边，靠近 SSC"
    },
    {
      "id": "sadc",
      "name": "SADC C0105",
      "floor": 1,
      "type": "office",
      "building": "C",
      "aliases": [ "sadc", "c0105" ],
      "poly": [ [305, 415], [388, 415], [388, 488], [305, 488] ],
      "location": "di antara SDC dan UKM, dekat SSC",
      "location_en": "between SDC and UKM, near SSC",
      "location_zh": "在 SDC 和 UKM 之间，靠近 SSC"
    },
    {
      "id": "ukm",
      "name": "UKM C0104",
      "floor": 1,
      "type": "office",
      "building": "C",
      "aliases": [ "ukm", "c0104", "unit kegiatan", "organisasi" ],
      "poly": [ [390, 415], [470, 415], [470, 488], [390, 488] ],
      "location": "di sebelah kanan SADC, dekat Marketing",